{
  "$schema": "http://json-schema.org/draft-07/schema#",
  "$id": "https://kari-writer.local/contracts/schemas/registry/document.entity.schema.json",
  "title": "DocopsDocumentEntity",
  "type": "object",
  "additionalProperties": true,
  "required": [
    "schemaVersion",
    "entityId",
    "kind",
    "docType",
    "logicalPath",
    "repoDocs"
  ],
  "properties": {
    "schemaVersion": { "type": "integer", "const": 1 },
    "entityId": {
      "type": "string",
      "minLength": 1,
      "pattern": "^[0-9a-f]{8}-[0-9a-f]{4}-[1-5][0-9a-f]{3}-[89ab][0-9a-f]{3}-[0-9a-f]{12}$"
    },
    "kind": { "type": "string", "enum": ["document", "data_source"] },
    "docType": { "type": "string", "minLength": 1 },
    "logicalPath": { "type": "string", "minLength": 1 },
    "repoDocs": {
      "type": "object",
      "minProperties": 1,
      "additionalProperties": { "type": "string", "minLength": 1 }
    },
    "displayName": { "type": "string" },
    "aliases": {
      "type": "array",
      "items": { "type": "string", "minLength": 1 }
    },
    "createdAt": { "type": "string" },
    "updatedAt": { "type": "string" }
  }
}
